{
  "$schema": "https://json-schema.org/draft/2020-12/schema",
  "title": "Sonicverse Stack Config",
  "type": "object",
  "required": ["version", "ingests", "outputs", "hls", "processing"],
  "additionalProperties": false,
  "properties": {
    "version": {
      "type": "integer",
      "const": 1
    },
    "ingests": {
      "type": "array",
      "minItems": 1,
      "items": {
        "type": "object",
        "required": ["id", "type", "port", "priority", "enabled"],
        "additionalProperties": false,
        "properties": {
          "id": {
            "type": "string",
            "pattern": "^[a-z][a-z0-9-]*$"
          },
          "type": {
            "type": "string",
            "const": "harbor"
          },
          "port": {
            "type": "integer",
            "minimum": 1024,
            "maximum": 65535
          },
          "priority": {
            "type": "integer",
            "minimum": 1
          },
          "enabled": {
            "type": "boolean"
          }
        }
      }
    },
    "outputs": {
      "type": "array",
      "items": {
        "type": "object",
        "required": [
          "id",
          "type",
          "mount",
          "codec",
          "bitrate",
          "samplerate",
          "channels",
          "enabled"
        ],
        "additionalProperties": false,
        "properties": {
          "id": {
            "type": "string",
            "pattern": "^[a-z][a-z0-9-]*$"
          },
          "type": {
            "type": "string",
            "const": "icecast"
          },
          "mount": {
            "type": "string",
            "pattern": "^/[a-z0-9-]+$"
          },
          "codec": {
            "type": "string",
            "enum": ["mp3", "fdkaac", "vorbis"]
          },
          "bitrate": {
            "type": "integer",
            "minimum": 32,
            "maximum": 512
          },
          "samplerate": {
            "type": "integer",
            "enum": [44100, 48000]
          },
          "channels": {
            "type": "integer",
            "enum": [1, 2]
          },
          "enabled": {
            "type": "boolean"
          }
        }
      }
    },
    "hls": {
      "type": "object",
      "required": ["enabled", "playlist", "segment_duration", "variants"],
      "additionalProperties": false,
      "properties": {
        "enabled": {
          "type": "boolean"
        },
        "playlist": {
          "type": "string",
          "pattern": "^[a-zA-Z0-9._-]+$"
        },
        "segment_duration": {
          "type": "number",
          "minimum": 2,
          "maximum": 10
        },
        "variants": {
          "type": "array",
          "items": {
            "type": "object",
            "required": ["id", "bitrate"],
            "additionalProperties": false,
            "properties": {
              "id": {
                "type": "string",
                "pattern": "^[a-z][a-z0-9_]*$"
              },
              "bitrate": {
                "type": "integer",
                "minimum": 32,
                "maximum": 512
              }
            }
          }
        }
      }
    },
    "processing": {
      "type": "object",
      "required": ["crossfade_seconds", "buffer_seconds", "max_buffer_seconds"],
      "additionalProperties": false,
      "properties": {
        "crossfade_seconds": {
          "type": "number",
          "minimum": 0,
          "maximum": 5
        },
        "buffer_seconds": {
          "type": "number",
          "minimum": 1,
          "maximum": 30
        },
        "max_buffer_seconds": {
          "type": "number",
          "minimum": 5,
          "maximum": 60
        }
      }
    }
  }
}
